{
  "schema_version": "pf-core.handoff.v0",
  "from_principal": {
    "schema_version": "pf-core.principal.v0",
    "id": "agent-1",
    "tenant_id": "tenant-a",
    "roles": [
      "cap:file-read",
      "cap:email-send",
      "cap:handoff",
      "cap:mcp-invoke"
    ]
  },
  "to_principal": {
    "schema_version": "pf-core.principal.v0",
    "id": "agent-2",
    "tenant_id": "tenant-a",
    "roles": [
      "cap:handoff"
    ]
  },
  "capability": {
    "schema_version": "pf-core.capability.v0",
    "id": "cap:handoff",
    "effect_kind": "handoff.delegate",
    "resource_pattern": "agent:*"
  }
}
